[
  {"id":"access-bank","name":"Access Bank Plc","cbn_code":"044","nip_code":"000014","official_website_url":"https://www.accessbankplc.com/","logo_url":"/v1/assets/banks/ng/access-bank.png","country_code":"NG"},
  {"id":"alpha-morgan-bank","name":"Alpha Morgan Bank Limited","nip_code":"000041","official_website_url":"https://www.alphamorganbank.com/","logo_url":"/v1/assets/banks/ng/alpha-morgan-bank.png","country_code":"NG","cbn_code":"108"},
  {"id":"citibank-nigeria","name":"Citibank Nigeria Limited","cbn_code":"023","nip_code":"000009","official_website_url":"https://www.citigroup.com/global/about-us/global-presence/nigeria","logo_url":"/v1/assets/banks/ng/citibank-nigeria.png","country_code":"NG"},
  {"id":"ecobank-nigeria","name":"Ecobank Nigeria Plc","cbn_code":"050","nip_code":"000010","official_website_url":"https://www.ecobank.com/","logo_url":"/v1/assets/banks/ng/ecobank-nigeria.png","country_code":"NG"},
  {"id":"fidelity-bank","name":"Fidelity Bank Plc","cbn_code":"070","nip_code":"000007","official_website_url":"https://www.fidelitybank.ng/","logo_url":"/v1/assets/banks/ng/fidelity-bank.png","country_code":"NG"},
  {"id":"first-bank-of-nigeria","name":"First Bank of Nigeria Limited","cbn_code":"011","nip_code":"000016","official_website_url":"https://www.firstbanknigeria.com/","logo_url":"/v1/assets/banks/ng/first-bank-of-nigeria.png","country_code":"NG"},
  {"id":"first-city-monument-bank","name":"First City Monument Bank Plc","cbn_code":"214","nip_code":"000003","official_website_url":"https://www.fcmb.com/","logo_url":"/v1/assets/banks/ng/first-city-monument-bank.png","country_code":"NG"},
  {"id":"globus-bank","name":"Globus Bank Limited","cbn_code":"103","nip_code":"000027","official_website_url":"https://globusbank.com/","logo_url":"/v1/assets/banks/ng/globus-bank.png","country_code":"NG"},
  {"id":"guaranty-trust-bank","name":"Guaranty Trust Bank Plc","cbn_code":"058","nip_code":"000013","official_website_url":"https://www.gtbank.com/","logo_url":"/v1/assets/banks/ng/guaranty-trust-bank.png","country_code":"NG"},
  {"id":"keystone-bank","name":"Keystone Bank Limited","cbn_code":"082","nip_code":"000002","official_website_url":"https://keystonebankng.com/","logo_url":"/v1/assets/banks/ng/keystone-bank.png","country_code":"NG"},
  {"id":"nova-bank","name":"Nova Commercial Bank Limited","official_website_url":"https://www.novabank.ng/","logo_url":"/v1/assets/banks/ng/nova-bank.png","country_code":"NG","cbn_code":"561","nip_code":"060003"},
  {"id":"optimus-bank","name":"Optimus Bank","cbn_code":"107","nip_code":"000036","official_website_url":"https://optimusbank.com/","logo_url":"/v1/assets/banks/ng/optimus-bank.png","country_code":"NG"},
  {"id":"parallex-bank","name":"Parallex Bank Ltd","cbn_code":"104","nip_code":"000030","official_website_url":"https://parallexbank.com/","logo_url":"/v1/assets/banks/ng/parallex-bank.png","country_code":"NG"},
  {"id":"polaris-bank","name":"Polaris Bank Plc","cbn_code":"076","nip_code":"000008","official_website_url":"https://polarisbanklimited.com/","logo_url":"/v1/assets/banks/ng/polaris-bank.png","country_code":"NG"},
  {"id":"premium-trust-bank","name":"Premium Trust Bank","cbn_code":"105","nip_code":"000031","official_website_url":"https://premiumtrustbank.com/","logo_url":"/v1/assets/banks/ng/premium-trust-bank.png","country_code":"NG"},
  {"id":"providus-bank","name":"Providus Bank","cbn_code":"101","nip_code":"000023","official_website_url":"https://providusbank.com/","logo_url":"/v1/assets/banks/ng/providus-bank.png","country_code":"NG"},
  {"id":"signature-bank","name":"Signature Bank Limited","nip_code":"000034","official_website_url":"https://signaturebankng.com/","logo_url":"/v1/assets/banks/ng/signature-bank.png","country_code":"NG","cbn_code":"106"},
  {"id":"stanbic-ibtc-bank","name":"Stanbic IBTC Bank Plc","cbn_code":"221","nip_code":"000012","official_website_url":"https://www.stanbicibtcbank.com/","logo_url":"/v1/assets/banks/ng/stanbic-ibtc-bank.png","country_code":"NG"},
  {"id":"standard-chartered-bank","name":"Standard Chartered Bank Nigeria Limited","cbn_code":"068","official_website_url":"https://www.sc.com/ng/","logo_url":"/v1/assets/banks/ng/standard-chartered-bank.png","country_code":"NG","nip_code":"000021"},
  {"id":"sterling-bank","name":"Sterling Bank Plc","cbn_code":"232","nip_code":"000001","official_website_url":"https://sterling.ng/","logo_url":"/v1/assets/banks/ng/sterling-bank.png","country_code":"NG"},
  {"id":"suntrust-bank","name":"SunTrust Bank Nigeria Limited","cbn_code":"100","official_website_url":"https://suntrustng.com/","logo_url":"/v1/assets/banks/ng/suntrust-bank.png","country_code":"NG","nip_code":"000022"},
  {"id":"tatum-bank","name":"Tatum Bank Limited","cbn_code":"109","nip_code":"000042","official_website_url":"https://tatumbank.com/","logo_url":"/v1/assets/banks/ng/tatum-bank.png","country_code":"NG"},
  {"id":"titan-trust-bank","name":"Titan Trust Bank Ltd","cbn_code":"102","nip_code":"000025","official_website_url":"https://titantrustbank.com/","logo_url":"/v1/assets/banks/ng/titan-trust-bank.png","country_code":"NG"},
  {"id":"union-bank","name":"Union Bank of Nigeria Plc","cbn_code":"032","nip_code":"000018","official_website_url":"https://unionbankng.com/","logo_url":"/v1/assets/banks/ng/union-bank.png","country_code":"NG"},
  {"id":"united-bank-for-africa","name":"United Bank for Africa Plc","cbn_code":"033","nip_code":"000004","official_website_url":"https://www.ubagroup.com/","logo_url":"/v1/assets/banks/ng/united-bank-for-africa.png","country_code":"NG"},
  {"id":"unity-bank","name":"Unity Bank Plc","cbn_code":"215","nip_code":"000011","official_website_url":"https://unitybankng.com/","logo_url":"/v1/assets/banks/ng/unity-bank.png","country_code":"NG"},
  {"id":"wema-bank","name":"Wema Bank Plc","cbn_code":"035","nip_code":"000017","official_website_url":"https://wemabank.com/","logo_url":"/v1/assets/banks/ng/wema-bank.png","country_code":"NG"},
  {"id":"zenith-bank","name":"Zenith Bank Plc","cbn_code":"057","nip_code":"000015","official_website_url":"https://www.zenithbank.com/","logo_url":"/v1/assets/banks/ng/zenith-bank.png","country_code":"NG"}
]
